{
  "schemaVersion": "1.0",
  "project": {
    "slug": "eliya-thebeautybrand",
    "workingTitle": "אליה יצחק — מאמנת שיווקית ומנטלית לעסקי ביוטי",
    "repository": "git@github.com:DaSheThe1/eliya-website.git",
    "owners": [
      "Daniel Shedrinsky"
    ],
    "sensitivity": "standard"
  },
  "business": {
    "identity": {
      "value": "אליה יצחק",
      "status": "confirmed",
      "source": {
        "kind": "website",
        "reference": "https://www.instagram.com/eliya_thebeautybrand/ — profile display name",
        "checkedAt": "2026-08-04T17:20:00Z"
      },
      "blockingLevel": "blocks-scaffold"
    },
    "offer": {
      "value": "שיחת ייעוץ אישית ללא עלות. אליה מלווה בעלות עסקי ביוטי בשיווק ובצד המנטלי, כדי למלא יומן בלקוחות ולהעלות מחירים.",
      "status": "confirmed",
      "source": {
        "kind": "client",
        "reference": "Daniel, conversation 2026-08-04: the only offer on the page is a free call; she has no named program",
        "checkedAt": "2026-08-04T18:40:00Z"
      },
      "blockingLevel": "blocks-scaffold"
    },
    "differentiators": [
      {
        "value": "שיווק וגם הצד המנטלי — ביטחון עצמי, תמחור, והמחסומים שמונעים מבעלת עסק להיראות",
        "status": "confirmed",
        "source": {
          "kind": "website",
          "reference": "Instagram bio: מאמנת שיווקית ומנטלית לעסקי ביוטי",
          "checkedAt": "2026-08-04T17:20:00Z"
        },
        "blockingLevel": "optional"
      },
      {
        "value": "מתמחה בעסקי ביוטי בלבד — לק ג'ל, בניית ציפורניים, עיצוב גבות וקוסמטיקה",
        "status": "confirmed",
        "source": {
          "kind": "website",
          "reference": "Instagram bio and client testimonials",
          "checkedAt": "2026-08-04T17:20:00Z"
        },
        "blockingLevel": "optional"
      },
      {
        "value": "תוצאות מדידות אצל לקוחות: יומן מלא, העלאת מחירים, וחשיפה אורגנית ברשתות",
        "status": "client-supplied",
        "source": {
          "kind": "client",
          "reference": "11 Instagram/WhatsApp screenshots supplied by Daniel 2026-08-04, assets/testimonials/raw/t01-t11.png",
          "checkedAt": "2026-08-04T19:30:00Z"
        },
        "blockingLevel": "optional"
      }
    ],
    "source": [
      {
        "kind": "website",
        "reference": "https://www.instagram.com/eliya_thebeautybrand/",
        "checkedAt": "2026-08-04T17:20:00Z"
      },
      {
        "kind": "website",
        "reference": "https://sparkle-thrive-growth.base44.app/ — previous site being replaced",
        "checkedAt": "2026-08-04T17:15:00Z"
      }
    ]
  },
  "audiences": [
    {
      "id": "beauty-business-owners",
      "description": {
        "value": "בעלות עסקי ביוטי בישראל — לק ג'ל, בניית ציפורניים, עיצוב והרמת גבות, קוסמטיקה — שיש להן מקצוע חזק אבל יומן לא מלא",
        "status": "confirmed",
        "source": {
          "kind": "website",
          "reference": "Instagram bio and the professions named across the supplied testimonials",
          "checkedAt": "2026-08-04T19:30:00Z"
        },
        "blockingLevel": "blocks-scaffold"
      },
      "priority": 1,
      "source": {
        "kind": "website",
        "reference": "https://www.instagram.com/eliya_thebeautybrand/",
        "checkedAt": "2026-08-04T17:20:00Z"
      }
    },
    {
      "id": "beauty-beginners",
      "description": {
        "value": "נשים בתחילת הדרך בתחום הביוטי שמפחדות להיראות ברשתות ולגבות מחיר מלא",
        "status": "derived",
        "source": {
          "kind": "agent-derived",
          "reference": "Recurring theme across testimonials t01, t03, t04 and the ל.כ written quote",
          "checkedAt": "2026-08-04T19:30:00Z"
        },
        "blockingLevel": "optional"
      },
      "priority": 2,
      "source": {
        "kind": "agent-derived",
        "reference": "Derived from supplied testimonial content",
        "checkedAt": "2026-08-04T19:30:00Z"
      }
    }
  ],
  "conversion": {
    "primary": {
      "id": "lead-free-call",
      "label": "לשיחת ייעוץ ללא עלות",
      "action": "submit-lead",
      "status": "confirmed",
      "source": {
        "kind": "client",
        "reference": "Daniel, 2026-08-04: the page exists to collect name and phone, not to push to WhatsApp",
        "checkedAt": "2026-08-04T18:40:00Z"
      }
    },
    "secondary": [
      {
        "id": "whatsapp-direct",
        "label": "וואטסאפ",
        "action": "whatsapp",
        "status": "confirmed",
        "source": {
          "kind": "client",
          "reference": "Daniel supplied 972547893950, taken from the CTA on her existing site",
          "checkedAt": "2026-08-04T18:40:00Z"
        }
      }
    ]
  },
  "localization": {
    "defaultLocale": "he",
    "locales": [
      {
        "locale": "he",
        "direction": "rtl",
        "status": "confirmed"
      }
    ]
  },
  "content": {
    "authority": [
      {
        "kind": "client",
        "reference": "Daniel Shedrinsky — approving authority for this speculative build; Eliya is not yet a client",
        "checkedAt": "2026-08-04T18:40:00Z"
      },
      {
        "kind": "website",
        "reference": "https://sparkle-thrive-growth.base44.app/ — source of the three written testimonials",
        "checkedAt": "2026-08-04T19:45:00Z"
      }
    ],
    "copyStatus": "partial",
    "mediaStatus": "partial",
    "testimonials": "verified",
    "claims": [
      {
        "id": "price-anchor",
        "text": "מחיר עוגן ₪1,090",
        "status": "placeholder",
        "source": {
          "kind": "placeholder",
          "reference": "Daniel invented this for funnel shape 2026-08-04; not Eliya's real price",
          "checkedAt": "2026-08-04T18:40:00Z"
        },
        "approval": {
          "status": "approved",
          "owner": "Daniel Shedrinsky",
          "approvedAt": "2026-08-04T18:40:00Z"
        }
      },
      {
        "id": "price-offer",
        "text": "מחיר מבצע ₪419",
        "status": "placeholder",
        "source": {
          "kind": "placeholder",
          "reference": "Daniel invented this for funnel shape 2026-08-04; not Eliya's real price",
          "checkedAt": "2026-08-04T18:40:00Z"
        },
        "approval": {
          "status": "approved",
          "owner": "Daniel Shedrinsky",
          "approvedAt": "2026-08-04T18:40:00Z"
        }
      },
      {
        "id": "gift-first-seven",
        "text": "מתנה לשבע הראשונות שמשאירות פרטים",
        "status": "placeholder",
        "source": {
          "kind": "placeholder",
          "reference": "Daniel invented this for funnel shape 2026-08-04",
          "checkedAt": "2026-08-04T18:40:00Z"
        },
        "approval": {
          "status": "approved",
          "owner": "Daniel Shedrinsky",
          "approvedAt": "2026-08-04T18:40:00Z"
        }
      },
      {
        "id": "testimonial-rm",
        "text": "הגעתי לאליה כשהייתי מיואשת לגמרי. תוך חודש של עבודה על הביטחון, ושיווק ברשתות היומן שלי התמלא בלקוחות חדשות אחרי שהעלתי מחיר. — ר.מ",
        "status": "client-supplied",
        "source": {
          "kind": "website",
          "reference": "https://sparkle-thrive-growth.base44.app/ — testimonial section, supplied verbatim by Daniel",
          "checkedAt": "2026-08-04T19:45:00Z"
        },
        "approval": {
          "status": "approved",
          "owner": "Daniel Shedrinsky",
          "approvedAt": "2026-08-04T19:45:00Z"
        }
      },
      {
        "id": "testimonial-ns",
        "text": "תמיד פחדתי להעלות מחירים. אליה נתנה לי את הביטחון להבין כמה אני שווה. היום אני מרוויחה פי 2 בפחות שעות עבודה. — נ.ש",
        "status": "client-supplied",
        "source": {
          "kind": "website",
          "reference": "https://sparkle-thrive-growth.base44.app/ — testimonial section, supplied verbatim by Daniel",
          "checkedAt": "2026-08-04T19:45:00Z"
        },
        "approval": {
          "status": "approved",
          "owner": "Daniel Shedrinsky",
          "approvedAt": "2026-08-04T19:45:00Z"
        }
      },
      {
        "id": "testimonial-lk",
        "text": "בתור מישהי שבחיים לא חשבה להצטלם, אליה הראתה לי איך להביא לקוחות בלי להרגיש פדחנית. וזה עבד מטורף. — ל.כ",
        "status": "client-supplied",
        "source": {
          "kind": "website",
          "reference": "https://sparkle-thrive-growth.base44.app/ — testimonial section, supplied verbatim by Daniel",
          "checkedAt": "2026-08-04T19:45:00Z"
        },
        "approval": {
          "status": "approved",
          "owner": "Daniel Shedrinsky",
          "approvedAt": "2026-08-04T19:45:00Z"
        }
      },
      {
        "id": "proof-screenshots",
        "text": "אחת עשרה תמונות מסך מאינסטגרם ווואטסאפ המתעדות תוצאות של לקוחות — יומן מלא, העלאת מחירים, וחשיפה אורגנית",
        "status": "client-supplied",
        "source": {
          "kind": "client",
          "reference": "assets/testimonials/raw/t01-t11.png — supplied by Daniel 2026-08-04, already public on Instagram, published as-is by owner decision",
          "checkedAt": "2026-08-04T19:30:00Z"
        },
        "approval": {
          "status": "approved",
          "owner": "Daniel Shedrinsky",
          "approvedAt": "2026-08-04T20:10:00Z"
        }
      }
    ]
  },
  "design": {
    "direction": {
      "value": "יוקרה בגוון כהה בלבד. בסיס כחול-ים כמעט שחור, אקסנט זהב חם, ניטרלי שמנת. ההשראה היא נוף פנטהאוז אל הים בשעת שקיעה, והפלטה נגזרת מתמונת ההצעה שלה על החוף. טיפוגרפיה עברית גדולה ובטוחה, הרבה שטח נשימה, בלי עומס.",
      "status": "derived",
      "source": {
        "kind": "client",
        "reference": "Daniel 2026-08-04: luxury, penthouse or penthouse view over the sea; dark mode only",
        "checkedAt": "2026-08-04T19:00:00Z"
      },
      "blockingLevel": "blocks-preview"
    },
    "references": [
      "assets/about/eliya-proposal-beach-sunset.jpg — palette source: gold, cream, deep sea blue at sunset",